{
  "$schema": "../../../../docs/architecture/schemas/ui-authoring.schema.json",
  "_schemaVersion": "1.0",
  "_manifestType": "ui",
  "_channel": "telegram",
  "_definitions": {
    "ui.AntarcticaTelegramManifest": {
      "_semantics": "Minimal Antarctica telegram UI manifest with a single screen. Parity-adoption wrapper before semantic prototype extraction.",
      "meta": {
        "id": "antarctica.ui.telegram",
        "version": "1.0.0",
        "game_id": "antarctica",
        "game_manifest_version": "1.0.0",
        "channel": "telegram",
        "author": "Cubica migration"
      },
      "entry_point": "S1",
      "screens": {
        "S1": {
          "_type": "ui.TelegramScreen"
        }
      },
      "layouts": {
        "layout.telegram.s1": {
          "target": {
            "kind": "screen",
            "id": "S1"
          },
          "image": "games/antarctica/assets/images/arctic-background.png",
          "spec": {
            "notes": "MVP placeholder for the Telegram screen layout."
          },
          "variant": "telegram",
          "meta": {
            "source": "migration"
          }
        }
      }
    },
    "ui.TelegramScreen": {
      "_semantics": "Telegram screen shell with MVP content for Antarctica.",
      "type": "screen",
      "title": "Antarctica (Telegram)",
      "layout_id": "layout.telegram.s1",
      "root": {
        "type": "screenComponent",
        "props": {
          "cssClass": "telegram-screen"
        },
        "children": [
          {
            "type": "areaComponent",
            "props": {
              "cssClass": "telegram-main"
            },
            "children": [
              {
                "type": "helperComponent",
                "id": "telegram-intro",
                "props": {
                  "text": "Telegram UI manifest (MVP): кнопки диспатчат команды, метрики читаются из game.state.public.metrics.*."
                }
              },
              {
                "type": "buttonComponent",
                "id": "telegram-request",
                "props": {
                  "caption": "Действие: requestServer"
                },
                "actions": {
                  "onClick": {
                    "command": "requestServer",
                    "payload": {}
                  }
                }
              }
            ]
          }
        ]
      }
    }
  },
  "root": {
    "_type": "ui.AntarcticaTelegramManifest"
  }
}
